{
  "$schema": "https://json-schema.org/draft/2020-12/schema",
  "$id": "https://w3id.org/abc/schemas/person-record.schema.json",
  "title": "ABC Person Record",
  "description": "Bibliographic record for one Aozora person. Identity (person-record-hash) is SHA-256 over RFC 8785 JCS bytes of this object with source_csv_provenance dropped. Nullable fields are explicit JSON null, not key-omission. Defaults are documentation only; canonicalization hashes the literal record. The hash is not stored in the file; it lives at reference sites in metadata-record contributors[] entries.",
  "type": "object",
  "additionalProperties": false,
  "required": [
    "person_record_schema_id",
    "person_record_schema_hash",
    "person_id",
    "family_name",
    "given_name",
    "person_copyright_expired"
  ],
  "properties": {
    "person_record_schema_id": {
      "const": "https://w3id.org/abc/schemas/person-record.schema.json"
    },
    "person_record_schema_hash": { "$ref": "#/$defs/hash" },
    "person_id": { "type": "string", "pattern": "^([0-9]{6}|abc-[0-9a-f]{12})$" },
    "family_name": { "type": "string", "minLength": 1 },
    "given_name": { "$ref": "#/$defs/nullableString" },
    "family_name_reading": { "$ref": "#/$defs/nullableString" },
    "given_name_reading": { "$ref": "#/$defs/nullableString" },
    "family_name_sort": { "$ref": "#/$defs/nullableString" },
    "given_name_sort": { "$ref": "#/$defs/nullableString" },
    "family_name_romaji": { "$ref": "#/$defs/nullableString" },
    "given_name_romaji": { "$ref": "#/$defs/nullableString" },
    "date_of_birth": { "$ref": "#/$defs/nullableDate" },
    "date_of_death": { "$ref": "#/$defs/nullableDate" },
    "person_copyright_expired": { "type": "boolean" },
    "external_links": {
      "type": "array",
      "items": { "type": "string", "format": "uri" },
      "uniqueItems": true,
      "default": []
    },
    "source_csv_provenance": { "$ref": "#/$defs/csvProvenance" }
  },
  "$defs": {
    "hash": {
      "type": "string",
      "pattern": "^sha256:[0-9a-f]{64}$"
    },
    "nullableString": { "type": ["string", "null"] },
    "nullableDate": {
      "description": "v0.1 EDTF lexical union: Level 0 (YYYY, YYYY-MM, YYYY-MM-DD with optional leading '-' for BCE) plus Level 1 decade (YYYX) and century (YYXX) digit-placeholder shapes. Month is 01-12; day is 01-31 (calendar validity for full dates is enforced parser-side via java.time.LocalDate). ADR 0015 specifies the L0 canonical form; ADR 0016 widens to admit L1 decade/century. EDTF Level 1 uncertainty markers, intervals, and sets remain out of v0 scope.",
      "anyOf": [
        { "type": "string", "pattern": "^(-?\\d{4}(-(0[1-9]|1[0-2])(-(0[1-9]|[12][0-9]|3[01]))?)?|-?\\d{3}X|-?\\d{2}XX)$" },
        { "type": "null" }
      ]
    },
    "parseCorrection": {
      "type": "object",
      "additionalProperties": false,
      "required": ["field", "raw", "corrected", "rule"],
      "properties": {
        "field": { "type": "string" },
        "raw": { "type": "string" },
        "corrected": {
          "description": "Post-normalization value. String for lexical/calendar corrections; null when the rule maps a sentinel (e.g. 不詳) to JSON null.",
          "anyOf": [
            { "type": "string" },
            { "type": "null" }
          ]
        },
        "rule": {
          "type": "string",
          "enum": [
            "pad-month",
            "pad-day",
            "pad-year",
            "strip-whitespace",
            "collapse-multi-dash",
            "normalize-date-separator",
            "bce-astronomical",
            "unknown-marker",
            "century-prose"
          ]
        }
      }
    },
    "csvProvenance": {
      "type": "object",
      "additionalProperties": false,
      "required": ["source_url", "retrieved_at", "original_file_hash"],
      "properties": {
        "source_url": {
          "description": "Canonical upstream URL for the source CSV. May be null when ingest is from a local file with no upstream URL.",
          "anyOf": [
            { "type": "string", "format": "uri" },
            { "type": "null" }
          ]
        },
        "retrieved_at": {
          "description": "ISO 8601 instant the CSV was retrieved. May be null when not knowable (e.g. ZIP entry without a stored mtime).",
          "anyOf": [
            { "type": "string", "format": "date-time" },
            { "type": "null" }
          ]
        },
        "original_file_hash": { "$ref": "#/$defs/hash" },
        "parse_corrections": {
          "type": "array",
          "items": { "$ref": "#/$defs/parseCorrection" }
        }
      }
    }
  }
}
